book_id,work_id,isbn,title,year_read,quote_text
42815544,58221942,0525559736,Bunny,2020,"The poets brace themselves for imminent, overeducated poverty."
42815544,58221942,0525559736,Bunny,2020,"We never joke about bunnies, Bunny."
42815544,58221942,0525559736,Bunny,2020,"Behold the lavish tent under which the overeducated mingle, well versed in every art but the one of conversation."
42815544,58221942,0525559736,Bunny,2020,They laugh. What so fucking funny? I want to say. But I don’t. I laugh with them. Ha. Haha. Hahaha.
42815544,58221942,0525559736,Bunny,2020,"But I wasn't listening. I wasn't stopping. Because we were already running away again, me and my imagination."
42815544,58221942,0525559736,Bunny,2020,"I don’t have those hair salon novels anymore. I like to think they were swallowed up in the Falls after she died. In my memory, those years remain my most prolific writing period although I’ve never really not written, never not had another world of my own making to escape to, never known how to be in this world without most of my soul dreaming up and living in another. Until I came here. Sometimes it good to take a break, the Lion said to me last January, whisking his tea. Focus on other things. Read. Be a guest in other worlds. Perhaps you’re growing. Evolving. Trust, Samantha. Patience."
42815544,58221942,0525559736,Bunny,2020,"The mothers always look around the campus like extremely interested buyers, their jeweled hands rubbing the backs of their fawnlike spawn as if to say: This could be yours, this could be yours."
42815544,58221942,0525559736,Bunny,2020,I look at all of my dreams and nightmares distilled into one man-shaped shape. All the love and hate I have in my heart plus one fucking bunny.
42815544,58221942,0525559736,Bunny,2020,"Why do you lie so much? And about the weirdest little things?"", my mother always asked me. ""I don’t know"", I always said. But I did know. It was very simple. Because it was a better story."
42815544,58221942,0525559736,Bunny,2020,Our mothers always said to look hard at the things of this world that are owies on the eyes because they will put more colors in your inner rainbow.
42815544,58221942,0525559736,Bunny,2020,"I look at her lips shiny and thick with so much gloss. There a wavering quality to her voice, like a car swerving down a dangerous road."
42815544,58221942,0525559736,Bunny,2020,"Then, Beowulf says wistfully, ""Your beauty is nuanced and labyrinthine like a sentence by Proust."
42815544,58221942,0525559736,Bunny,2020,"A song I used to hate that I loved surround-sounds my soul. It is a song about nightmares dressed as daydreams, about trading your soul for a kiss. I think not this song, never this song, but my soul is already singing along, riding its swells like an ocean wave, shimmering."
42815544,58221942,0525559736,Bunny,2020,"They each look at Ava, then at me, in turn, scanning down from our heads to our feet, their eyes taking us in like little mouths sipping strange drinks. As they do, their noses twitch, their eight eyes do not blink, but stare and stare. Then they look back at the Duchess and lean in to each other, their lip-glossed mouths forming whispery words. Ava squeezes my arm, hard. The Duchess turns and arches an eyebrow at us. She raises a hand up. Is there an invisible gun in it? No. It an empty, open hand. With which she then waves. At me. With something like a smile on her face. Hi, her mouth says. My hand shoots up of its own accord before I can even stop myself. I’m waving and waving and waving. Hi, I’m saying with my mouth, even though no sound comes out. Then the rest of the Bunnies hold up a hand and wave too."
42815544,58221942,0525559736,Bunny,2020,"I walk toward what I think is the school, getting lost again and again until at last the moldering, vacant storefronts switch to juice bars and dog salons and I glimpse the Ivy Bubble. The towers upon which Ava and I have sat like gargoyles. Everyone on the street suddenly goes from looking like an extra in a zombie movie to the star of a French New Wave film."
42815544,58221942,0525559736,Bunny,2020,"What do you think, Samantha? Fosco asks me. That it a piece of pretentious shit. That it says nothing, gives nothing. That I don’t understand it, that probably no one does and no one ever will. That not being understood is a privilege I can’t afford. That I can’t believe this woman got paid to come here. That I think she should apologize to trees. Spend a whole day on her knees in the forest, looking up at the trembling aspens and oaks and whatever other trees paper is made of with tears in her languid eyes and say, I’m fucking sorry. I’m sorry that I think I’m so goddamned interesting when it is clear that I am not interesting. Here what I am: I’m a boring tree murderess. But I look at Vignette, at Creepy Doll, at Cupcake, the Duchess. All of them staring at me now with shy smiles. I think I’d like to see more of the soup too, I hear myself say."
42815544,58221942,0525559736,Bunny,2020,"I swallow. My hands ungrip the cliff. Trust. I will not fall, I will float. Up into their high blue sky full of fluffy clouds and rainbows. Up, up, up into the pink mist and the laughing light."
42815544,58221942,0525559736,Bunny,2020,"Can I take your coat? Cupcake offers. I turn to her. She looking at me so hopefully. So willing to take a coat I’m not wearing, I almost want to give her my skin."
42815544,58221942,0525559736,Bunny,2020,"The real world, lady. It out there. Do you even know that? You’re going to have to get back to it sometime."
42815544,58221942,0525559736,Bunny,2020,The light from her stolen lamp buzzing over her feathery head like a flickering motel sign. Sipping champagne from a wide-mouthed flute. Where does she get it? Never mind. Places. Ava never seems to worry about money. Yet somehow her apartment is like a movie of arty poverty in Paris. Run-down but chicly so.
42815544,58221942,0525559736,Bunny,2020,"And here what I realize: she would never wear mittens shaped like kittens or a dress with a Peter Pan collar. She would never say, Love your dress, if she fucking hated your dress. She would never say, How are you? if she didn’t care how you were. She would never eat a lavender cupcake that tasted like perfume or wear a perfume that made her smell like a cupcake. She would never wear lip balm for cosmetic purposes. She would never wear it unless her lips were seriously, seriously cracked. And even if they were, she’d still put Lady Danger on them, which is the name of her lipstick, this bright blue-red that looks surreally beautiful on her but when I tried it on once made me look insane. Her perfume smells like rain and smoke and her eye makeup scares small children and she wears pumps even though she at least two inches taller than I am and I’m a freak."
42815544,58221942,0525559736,Bunny,2020,"Her neighborhood is obscenely beautiful. I cannot help but observe this as I stand on her marbled steps, flanked by stone griffins, beaks open in midscreech. A line of stately houses, a canopy of grandly bowing trees. Just a block from campus, off a poshly quaint street lined with bistros that offer champagne by the glass, cafés that make the cortadas with the ornate foam art that all the faculty drink, shops selling cold-pressed juice and organic dog treats. Unlike my street, which smells of sad man piss, hers smells of autumn leaves."
42815544,58221942,0525559736,Bunny,2020,"And it could definitely use more . . . bounce? Vignette says, looking at the Duchess, who has said nothing up to this point. We want more, I guess is what we’re saying, Samantha, the Duchess says. Hands braided over my pages, looking not at me but at Fosco, who nods with motherly gravitas. Does that make sense?"
42815544,58221942,0525559736,Bunny,2020,"We've read Jane Eyre too, you cunt, and we've read The Waves, and when we read it, you know, we wept for minutes.Then he stars weeping."
42815544,58221942,0525559736,Bunny,2020,"The real world lady, it's out there. Do you even know that? You're going to have to get back to it sometime."
42815544,58221942,0525559736,Bunny,2020,"You want to fuck, not be fucked, Victoria says. Samantha, Eleanor intones, is this making sense? I stare at them all through Kira pink heart-shaped glasses. This is how she must see the world all the time. I look at their dark pink faces, so suddenly grave. I should call the police. I should run to Mexico. Totally."
42815544,58221942,0525559736,Bunny,2020,Now I see his leonine face fall slightly at the sight of students with whom he must fraternize. Ask about their summers. Their writing. Did they get their stipend checks okay? And then there the fact that I’m one of the students. Makes it much more difficult. But he smiles. Of course he does. It his job.
42815544,58221942,0525559736,Bunny,2020,"Then the zoo to say hello to the Moon Bear in his pit. Then out for Vietnamese iced coffees at the sketchy place we like downtown, where I almost got shot. You did not almost get shot, Smackie. Jesus Christ. That was a car backing up or something, she said when I brought it up. Yes, I did. You need to get out more. I get out. I’m out with you, aren’t I? Now we’re back at her place drinking the sangria she made that so strong I’m pretty sure it poison. It that time of evening she calls the hour between the dog and the wolf. A time that actually makes this sorry swath of New England beautiful, the sky ablaze with a sunset the color of flamingos. We’re on her sagging roof, listening to Argentine tango music to drown out the roaring Mexican music next door."
42815544,58221942,0525559736,Bunny,2020,"What's the lesson here, Smackie?Don't jump to conclusions?Never lower your gaze first."
42815544,58221942,0525559736,Bunny,2020,...an endlessly entitled fury that will drive them toward the shiny pretty things of this world and not stop until they have claimed them.
38589871,59739980,1947793152,Bitter Orange,2020,"But the world is a nicer place when you think everyone is telling the truth. There are no agendas, no hidden motives; no one lies for dramatic effect."
38589871,59739980,1947793152,Bitter Orange,2020,"I learned from the wig-men that the law is not about finding the truth, it is about who can tell the most convincing story. It is a game that must be grasped swiftly if you want to win, even if to everyone else it looks as though you have lost."
38589871,59739980,1947793152,Bitter Orange,2020,"Beautiful on the surface, but look a little closer and everything is decaying, rotting, falling apart."
38589871,59739980,1947793152,Bitter Orange,2020,"The all-seeing eye. What has it seen? Nothing as interesting as the things I saw through the judas hole at Lyntons. But of course, the difference is privacy. The other women will complain and shout about being looked at without warning. But I think it is better to know when someone is watching rather than to live your life under an invisible gaze."
38589871,59739980,1947793152,Bitter Orange,2020,"Her story would have been simply memory and imagination without me to hear it; undiscovered and unaired, like a book without a reader. My second role was from the wings: the prompter."
38589871,59739980,1947793152,Bitter Orange,2020,"Now I am a woman of bone and skin, the patches of pigmentation like a map of a rocky archipelago; I am obdurate and uncooperative, drifting on a sea of memory between islands of lucidity."
38589871,59739980,1947793152,Bitter Orange,2020,"Yours have passed away too? I asked her. She shrugged and said, Peter still has both of his, squirrelled away in Devon or Dorset. Her voice was low, whispering a secret. I think he embarrassed by them —their cheeks are too ruddy, or they look too much like their dogs. I stared at her, shocked, until she laughed and I realised she was joking."
38589871,59739980,1947793152,Bitter Orange,2020,"If food is worth eating, it's worth eating properly"
38589871,59739980,1947793152,Bitter Orange,2020,"Best let hidden things remain hidden, I should have said. Sleeping dogs and all that. If I was then the woman I am now I would have shouted and stood between the sledgehammer and the door that day, when Peter opened the Museum."
38589871,59739980,1947793152,Bitter Orange,2020,"I shifted and the stiff underwear creaked, a loud awkward noise which none of us commented on."
38589871,59739980,1947793152,Bitter Orange,2020,"Are you superstitious?’ This time I must have said it aloud, because he answers. ‘Black cats and rabbits’ feet?’ ‘That sort of thing,’ I say, and he leans in further to listen. ‘White cows and butterflies, field mice and hares. I saw a hare once in the library at Lyntons.’ Victor tenses, hopeful for a net that he can use to save me. A child net on a stick that he can thrust into the rushing water where I spin and turn in the eddies. He would scoop me out if he could. But there nothing now that will stop me flowing downstream with the current. Soon I’ll reach the falls and be swept over the brink, and that will be the end of me."
18736,1273992,0767902351,Going to Pieces Without Falling Apart: A Buddhist Perspective on Wholeness,2020,The spiritual path means making a path rather than following one.
18736,1273992,0767902351,Going to Pieces Without Falling Apart: A Buddhist Perspective on Wholeness,2020,The only way to find out where I was was to get out of the way and let myself happen.
18736,1273992,0767902351,Going to Pieces Without Falling Apart: A Buddhist Perspective on Wholeness,2020,Stillness does not mean the elimination of disturbances as much as a different way of viewing them.
18736,1273992,0767902351,Going to Pieces Without Falling Apart: A Buddhist Perspective on Wholeness,2020,"In building a path through the self to the far shore of awareness, we have to carefully pick our way through our own wilderness. If we can put our minds into a place of surrender, we will have an easier time feeling the contours of the land. We do not have to break our way through as much as we have to find our way around the major obstacles. We do not have to cure every neurosis, we just have to learn how not to be caught by them."
18736,1273992,0767902351,Going to Pieces Without Falling Apart: A Buddhist Perspective on Wholeness,2020,We do not get lots of realizations in our lives as much as we get the same ones over and over.
18736,1273992,0767902351,Going to Pieces Without Falling Apart: A Buddhist Perspective on Wholeness,2020,"Intimacy puts us in touch with fragility, he realized, and the acceptance of fragility opens us to intimacy."
18736,1273992,0767902351,Going to Pieces Without Falling Apart: A Buddhist Perspective on Wholeness,2020,"Love is the revelation of the other person freedom,"
18736,1273992,0767902351,Going to Pieces Without Falling Apart: A Buddhist Perspective on Wholeness,2020,The mind that realizes its own Buddha nature is said to be like clear space—it is empty and all-pervasive but also vividly aware.
18736,1273992,0767902351,Going to Pieces Without Falling Apart: A Buddhist Perspective on Wholeness,2020,"The more we come to terms with our own separateness, taught the Buddha, the more we can feel the connections that are already there."
18736,1273992,0767902351,Going to Pieces Without Falling Apart: A Buddhist Perspective on Wholeness,2020,"Buddhism teaches us that we are not so much isolated individuals as we are overlapping environments, and that we have the capacity to know ourselves in this way."
18736,1273992,0767902351,Going to Pieces Without Falling Apart: A Buddhist Perspective on Wholeness,2020,Completion comes not from adding another piece to ourselves but from surrendering our ideas of perfection.
18736,1273992,0767902351,Going to Pieces Without Falling Apart: A Buddhist Perspective on Wholeness,2020,"With some gratitude, I realized that my awareness was now stronger than my neurosis. This did not mean that things would never go to pieces, only that I did not have to fall apart when they did. In fact, my own ability to go to pieces was protecting me in this situation. I did not have to let my identity as an efficient and together person imprison me."
18736,1273992,0767902351,Going to Pieces Without Falling Apart: A Buddhist Perspective on Wholeness,2020,"Just as mind rises up and rebels at un unskillful attempt to subdue it in meditation, a relationship will fall apart if the partners are not respectful of each other's differences. <...> Separateness and connection make each other possible; they are not mutually exclusive."
18736,1273992,0767902351,Going to Pieces Without Falling Apart: A Buddhist Perspective on Wholeness,2020,What I had learned from Buddhism was that I did not have to know myself analytically as much as I had to tolerate not knowing.
18736,1273992,0767902351,Going to Pieces Without Falling Apart: A Buddhist Perspective on Wholeness,2020,We are afraid to venture into the unknown because to do so would remind us of how unsafe we once felt.
18736,1273992,0767902351,Going to Pieces Without Falling Apart: A Buddhist Perspective on Wholeness,2020,"I felt silly to be falling into such an obvious trap of letting my expectations interfere with what was actually happening, but I also felt an all-too-familiar sadness creeping up from my chest to my eyes. In the stillness of the retreat I saw how I did this a lot: envisioning how something, or someone, had to be perfect, and then being disappointed when they failed, pulling myself back into a sullen remove."
18736,1273992,0767902351,Going to Pieces Without Falling Apart: A Buddhist Perspective on Wholeness,2020,"Joseph made clear, it is not just the mother that has to be released from perfection. It is everything."
18736,1273992,0767902351,Going to Pieces Without Falling Apart: A Buddhist Perspective on Wholeness,2020,"Separate and together cease to be mutually exclusive and instead become, in psychoanalyst Christopher Bolla's phrase, ""reciprocally enhancing and mutually informative."
18736,1273992,0767902351,Going to Pieces Without Falling Apart: A Buddhist Perspective on Wholeness,2020,"In making a path like the Buddha, we discover our own capacities for relationship. Doing this is like feeling our way in the dark. We need a healthy appreciation for what kind of obstacles we are facing within ourselves, and we need a method for working our way around those obstacles. It is in this sense that the path is the goal - opening leads to further opening. The Buddha's meditative teachings are about finding and incorporating a method around our obstacles."
18736,1273992,0767902351,Going to Pieces Without Falling Apart: A Buddhist Perspective on Wholeness,2020,"Like meditation, psychotherapy has the potential to reveal how much of our thinking is an artificial construaction designed to help us cope with an unpredictable world."
18736,1273992,0767902351,Going to Pieces Without Falling Apart: A Buddhist Perspective on Wholeness,2020,"I began to think that there was something awesome about my timing. How was it that, at the exact moment of my stopping, such incredible things were happening? It took me longer than I am prepared to admit to realize that such things were always happening. It was only that I was finally paying attention."
18736,1273992,0767902351,Going to Pieces Without Falling Apart: A Buddhist Perspective on Wholeness,2020,Implicit and explicit throughout the text is the understanding that meditative wisdom does not have to be isolated from daily life. Our need to expand awareness beyond our isolated egos is as necessary in relationships as it is in meditation.
18736,1273992,0767902351,Going to Pieces Without Falling Apart: A Buddhist Perspective on Wholeness,2020,"Form is emptiness"", the Buddhists teach, but form is also form. I would never be able to approach the emptiness of form if I continued to deny myself the experience of it."
18736,1273992,0767902351,Going to Pieces Without Falling Apart: A Buddhist Perspective on Wholeness,2020,"The antidote to hatred in the heart, the source of violence, is tolerance. Tolerance is an important virtue of bodhisattvas (enlightened heroes and heroines)—it enables you to refrain from reacting angrily to the harm inflicted on you by others. You could call this practice inner disarmament, in that a well-developed tolerance makes you free from the compulsion to counterattack. For the same reason, we also call tolerance the best armor, since it protects you from being conquered by hatred itself. THE DALAI LAMA"
18736,1273992,0767902351,Going to Pieces Without Falling Apart: A Buddhist Perspective on Wholeness,2020,"In coping with the world, we come to identify only with our compensatory selves and our reactive minds. We build up our selves out of our defenses but then come to be imprisoned by them."
18736,1273992,0767902351,Going to Pieces Without Falling Apart: A Buddhist Perspective on Wholeness,2020,Delusion is the mind tendency to seek premature closure about something. It is the quality of mind that imposes a definition on things and then mistakes the definition for the actual experience.
18736,1273992,0767902351,Going to Pieces Without Falling Apart: A Buddhist Perspective on Wholeness,2020,... everything had changed but nothing was altered.
50269327,64972303,1783785675,Earthlings,2020,"The person who had given birth to me said I was a dead loss, so I decided it really must be true."
22181319,41529556,1629630357,Sisters of the Revolution: A Feminist Speculative Fiction Anthology,2020,"But what is life without grumbling, and the occasional opportunity to say, I told you so?"
41057294,59141209,1984822179,Normal People,2020,"It was culture as class performance, literature fetishised for its ability to take educated people on false emotional journeys, so that they might afterwards feel superior to the uneducated people whose emotional journeys they liked to read about."
41057294,59141209,1984822179,Normal People,2020,"Marianne had the sense that her real life was happening somewhere very far away, happening without her, and she didn't know if she would ever find out where it was or become part of it."
41057294,59141209,1984822179,Normal People,2020,"No one can be independent of other people completely, so why not give up the attempt, she thought, go running in the other direction, depend on people for everything, allow them to depend on you, why not."
41057294,59141209,1984822179,Normal People,2020,"She closes her eyes. He probably won’t come back, she thinks. Or he will, differently. What they have now they can never have back again. But for her the pain of loneliness will be nothing to the pain that she used to feel, of being unworthy. He brought her goodness like a gift and now it belongs to her. Meanwhile his life opens out before him in all directions at once. They’ve done a lot of good for each other. Really, she thinks, really. People can really change one another.You should go, she says. I’ll always be here. You know that."
41057294,59141209,1984822179,Normal People,2020,Generally I find men are a lot more concerned with limiting the freedoms of women than exercising personal freedom for themselves.
41057294,59141209,1984822179,Normal People,2020,"Life offers up these moments of joy despite everything,"
41057294,59141209,1984822179,Normal People,2020,"She believes Marianne lacks ‘warmth’, by which she means the ability to beg for love from people who hate her."
41057294,59141209,1984822179,Normal People,2020,Life is the thing you bring with you inside your own head.
41057294,59141209,1984822179,Normal People,2020,"It's funny the decisions you make because you like someone, he says, and then your whole life is different. I think we're at that weird age where life can change a lot from small decisions."
41057294,59141209,1984822179,Normal People,2020,"Her eyes fill up with tears again and she closes them. Even in memory she will find this moment unbearably intense, and she's aware of this now, while it's happening. She has never believed herself fit to be loved by any person. But now she has a new life, of which this is the first moment, and even after many years have passed she will still think: Yes, that was it, the beginning of my life."
41057294,59141209,1984822179,Normal People,2020,"Not for the first time Marianne thinks cruelty does not only hurt the victim, but the perpetrator also, and maybe more deeply and more permanently."
41057294,59141209,1984822179,Normal People,2020,"Most people go through their whole lives, without ever really feeling that close with anyone."
41057294,59141209,1984822179,Normal People,2020,"If people appeared to behave pointlessly in grief, it was only because human life was pointless, and this was the truth that grief revealed"
41057294,59141209,1984822179,Normal People,2020,"Not for the first time Marianne thinks cruelty does not only hurt the victim, but the perpetrator also, and maybe more deeply and more permanently. You learn nothing very profound about yourself simply by being bullied; but by bullying someone else you learn something you can never forget."
41057294,59141209,1984822179,Normal People,2020,"It feels powerful to him to put an experience down in words, like he's trapping it in a jar and it can never fully leave him."
41057294,59141209,1984822179,Normal People,2020,I' m not a religious person but I do sometimes think God made you for me.
41057294,59141209,1984822179,Normal People,2020,"There always been something inside her that men have wanted to dominate, and their desire for domination can look so much like attraction, even love."
41057294,59141209,1984822179,Normal People,2020,Being alone with her is like opening a door away from normal life and then closing it behind him.
