book_id,work_id,isbn,title,year_read,quote_text
13641208,19256026,0812993802,Tenth of December,2019,The thing about girls? Suzanne said. Is we are more content-driven.
13641208,19256026,0812993802,Tenth of December,2019,"Is this the baby?"" I said.Ma turned on me again.""What do you think it is?"" she said. ""A midget that can't talk?"
13641208,19256026,0812993802,Tenth of December,2019,A house on the park. He'd seen it a million times. And now was in it. It smelled of man sweat and spaghetti sauce and old books. Like a library where sweaty men went to cook spaghetti.
13641208,19256026,0812993802,Tenth of December,2019,"Do not really like rich people, as they make us poor people feel dopey and inadequate. Not that we are poor. I would say we are middle. We are very, very lucky. I know that. But still, it is not right that rich people make us middle people feel dopey and inadequate."
13641208,19256026,0812993802,Tenth of December,2019,The contours of the coming disaster expanded to include the deaths of all present.
13641208,19256026,0812993802,Tenth of December,2019,"Did he still want it? Did he still want to live?Yes, yes, oh, God, yes, please.Because, O.K., the thing was—he saw it now, was starting to see it—if some guy, at the end, fell apart, and said or did bad things, or had to be helped, helped to quite a considerable extent? So what? What of it? Why should he not do or say weird things or look strange or disgusting? Why should the shit not run down his legs? Why should those he loved not lift and bend and feed and wipe him, when he would gladly do the same for them? He’d been afraid to be lessened by the lifting and bending and feeding and wiping, and was still afraid of that, and yet, at the same time, now saw that there could still be many—many drops of goodness, is how it came to him—many drops of happy—of good fellowship—ahead, and those drops of fellowship were not—had never been—his to withheld.Withhold."
13641208,19256026,0812993802,Tenth of December,2019,Kissing him last night at the pep rally had been like kissing an underpass.
13641208,19256026,0812993802,Tenth of December,2019,"...graduate college, win Pam, get job, make babies, move ahead in job, forget former feeling of special destiny..."
13641208,19256026,0812993802,Tenth of December,2019,"A bad thing happened to you kids, Dad said. But it could have been worse.So much worse, Mom said.But because of you kids, Dad said, it wasn't.You did so good, Mom said.Did beautiful, Dad said."
13641208,19256026,0812993802,Tenth of December,2019,"But hereby resolve to write in this book at least twenty minutes a night. (If discouraged, just think of how much will have been recorded for posterity after one mere year!) (September 5) Oops. Missed a day."
13641208,19256026,0812993802,Tenth of December,2019,"I was back to feeling myself which, believe me, is no picnic."
13641208,19256026,0812993802,Tenth of December,2019,Josh joined her at the window. She let him look. He should know that the world was not all lessons and iguanas and Nintendo. It was also this muddy simple boy tethered like an animal.
13641208,19256026,0812993802,Tenth of December,2019,"From across the woods, as if by common accord, birds left their trees and darted upward. I joined them, flew amount them, they did not recognize me as something apart from them, and I was happy, so happy, because for the first time in years, and forevermore, I had not killed, and never would."
13641208,19256026,0812993802,Tenth of December,2019,"Oh, mansion shmansion. Did Gandhi's house have the largest outdoor trampoline in the tristate area? Did Jesus have a two-acre remote-controlled car track, with mountains to scale and a little village that lit up at night?Not in his Bible."
13641208,19256026,0812993802,Tenth of December,2019,"Stood awhile watching, thinking, praying: Lord, give us more. Give us enough. Help us not fall behind peers. Help us not, that is, fall further behind peers. For kids’ sake. Do not want them scarred by how far behind we are. That is all I ask."
31554413,52235042,0316300330,The Boy on the Bridge (The Girl With All the Gifts #2),2019,"He had already learned to read, but now he learned the pleasure of stories which is like no other pleasure—the experience of slipping sideways into another world and living there for as long as you want to."
31554413,52235042,0316300330,The Boy on the Bridge (The Girl With All the Gifts #2),2019,"Things don’t end, after all. They only change, and you keep changing with them."
31554413,52235042,0316300330,The Boy on the Bridge (The Girl With All the Gifts #2),2019,"Sanity is a suspended state, moored in nothing but itself. You test the ground an inch in front of you, move forward as though it's solid. But the whole world is in freefall and you're in freefall with it."
31554413,52235042,0316300330,The Boy on the Bridge (The Girl With All the Gifts #2),2019,It rains on the just and the unjust. Nothing you can do but turn your collar up.
31554413,52235042,0316300330,The Boy on the Bridge (The Girl With All the Gifts #2),2019,"If everyone always knows what they’re doing and acts in a perfectly rational way, how did most of world history happen?"
31554413,52235042,0316300330,The Boy on the Bridge (The Girl With All the Gifts #2),2019,They think he doesn’t understand. That he can’t see. They can’t see him.
31554413,52235042,0316300330,The Boy on the Bridge (The Girl With All the Gifts #2),2019,"She thinks: all journeys are the same journey, whether you're moving or not. And the things that look like endings are all just stations on the way."
31554413,52235042,0316300330,The Boy on the Bridge (The Girl With All the Gifts #2),2019,She is an anomaly. Anomalies explode old theories and engender new ones. They are dangerous and glorious. Greaves
31554413,52235042,0316300330,The Boy on the Bridge (The Girl With All the Gifts #2),2019,"They are in hell, but the devil is on their side."
31554413,52235042,0316300330,The Boy on the Bridge (The Girl With All the Gifts #2),2019,"The daytime burns with a single fire, and a lot of the time it burns fitfully. The night is a million suns exploding all at once, igniting the whole sky."
31554413,52235042,0316300330,The Boy on the Bridge (The Girl With All the Gifts #2),2019,"Sanity is a suspended state, moored in nothing but itself. You test the ground an inch in front of you, move forward as though it solid. But the whole world is in freefall and you’re in freefall with it."
31554413,52235042,0316300330,The Boy on the Bridge (The Girl With All the Gifts #2),2019,"To go mad, to lose your mind, which is the only thing that really yours because it really you … That would be an inexpressibly terrible thing. And at the same time it would be nothing, because you yourself would be unable, from within that damaged state, to recognise or reflect on it."
31554413,52235042,0316300330,The Boy on the Bridge (The Girl With All the Gifts #2),2019,"If he says something that isn’t true, he is bringing uncertainty into the world. He is blinding the people around him to a small part of the truth—and every part of the truth is important. You can’t complete a jigsaw if one of its pieces has been swapped out for a piece of a different jigsaw."
31554413,52235042,0316300330,The Boy on the Bridge (The Girl With All the Gifts #2),2019,"The point of history, the very essence of it as a field of study, is to find correspondences. You look at the past so that you can understand it, and through it you come to a better understanding of your own time."
31554413,52235042,0316300330,The Boy on the Bridge (The Girl With All the Gifts #2),2019,Loyalty is just the wheels on the bus ... meaning that it keeps things moving but it's neutral when it comes to the direction they move in.
31554413,52235042,0316300330,The Boy on the Bridge (The Girl With All the Gifts #2),2019,"It absolutely necessary to know who you are, as the basis for knowing anything else."
31554413,52235042,0316300330,The Boy on the Bridge (The Girl With All the Gifts #2),2019,"admires her honesty, which turns white lies into red roadkill."
31554413,52235042,0316300330,The Boy on the Bridge (The Girl With All the Gifts #2),2019,The world is information. An endless torrent. Whatever escapes you becomes something you will never completely understand.
31554413,52235042,0316300330,The Boy on the Bridge (The Girl With All the Gifts #2),2019,"Pain has no agenda at all. It teaches us nothing, except what hurts. And if you can’t avoid the things that hurt then what use is the lesson?"
31554413,52235042,0316300330,The Boy on the Bridge (The Girl With All the Gifts #2),2019,The world is information. An endless torrent. Whatever escapes you becomes something you will never completely understand. Other
31554413,52235042,0316300330,The Boy on the Bridge (The Girl With All the Gifts #2),2019,"She thinks: all journeys are the same journey, whether you know it or not, whether you’re moving or not. And the things that look like endings are all just stations on the way."
31554413,52235042,0316300330,The Boy on the Bridge (The Girl With All the Gifts #2),2019,"Do we always fret about our partners’ exes? he wonders. And do we extend that to everyone they knew before they met us? Is it their whole past we’re jealous of, as though we want them to be born again when we walk into their lives? It a depressing thought. He has believed himself to be bigger than that, and a whole lot more rational."
31554413,52235042,0316300330,The Boy on the Bridge (The Girl With All the Gifts #2),2019,"People only make sense from the inside, Foss has found. And that if you’re lucky."
31554413,52235042,0316300330,The Boy on the Bridge (The Girl With All the Gifts #2),2019,Overthrow is a nicely judged word. It suggests a wrestler being flung to the mat. That only happens when you move outside your centre of gravity. Your enemy can’t throw you if you have your feet firmly planted. Which
31554413,52235042,0316300330,The Boy on the Bridge (The Girl With All the Gifts #2),2019,"He is not a politician. He not even somebody who weighs his words. But he is, in the end, a conformist. A man whose centre of gravity can’t easily be found because he has never taken the time to work out where it is he wants to stand. He only knows his limits when he actually meets them, in the world. As,"
31554413,52235042,0316300330,The Boy on the Bridge (The Girl With All the Gifts #2),2019,"You shouldn’t kill a man without being aware of the possibilities, the futures, you’re snuffing out. The younger the target, the more of those possible futures there are. Killing a child is like killing a vast multitude."
31554413,52235042,0316300330,The Boy on the Bridge (The Girl With All the Gifts #2),2019,"what so great about leaving your mark on things. You have a life and then it ends and you’re dead. Living it is the point, not proving to other people that you were there."
31554413,52235042,0316300330,The Boy on the Bridge (The Girl With All the Gifts #2),2019,"... he doesn’t see what so great about leaving your mark on things. You have a life and then it ends and you’re dead. Living it is the point, not proving to other people that you were there."
31554413,52235042,0316300330,The Boy on the Bridge (The Girl With All the Gifts #2),2019,"You look at the past so that you can understand it, and through it you come to a better understanding of your own time."
31554413,52235042,0316300330,The Boy on the Bridge (The Girl With All the Gifts #2),2019,"You look at the past so that you can understand it, and through it you come to a better understanding of your own time. If you’re lucky, sometimes you can even extrapolate to possible futures."
29751398,50108451,0670919985,The Power,2019,"It doesn't matter that she shouldn't, that she never would. What matters is that she could, if she wanted. The power to hurt is a kind of wealth."
29751398,50108451,0670919985,The Power,2019,"One of them says, 'Why did they do it?'And the other answers, 'Because they could.'That is the only answer there ever is."
29751398,50108451,0670919985,The Power,2019,Gender is a shell game. What is a man? Whatever a woman isn't. What is a woman? Whatever a man is not. Tap on it and it's hollow. Look under the shells: it's not there.
29751398,50108451,0670919985,The Power,2019,"This is the trouble with history. You can't see what's not there. You can look at an empty space and see that something's missing, but there's no way to know what it was."
29751398,50108451,0670919985,The Power,2019,The truth has always been a more complex commodity than the market can easily package and sell.
29751398,50108451,0670919985,The Power,2019,"You have been taught that you are unclean, that you are not holy, that your body is impure and could never harbour the divine. You have been taught to despise everything you are and to long only to be a man. But you have been taught lies."
29751398,50108451,0670919985,The Power,2019,"Nothing special has happened today; no one can say she was more provoked than usual. It is only that every day one grows a little, every day something is different, so that in the heaping up of days suddenly a thing that was impossible has become possible. This is how a girl becomes a grown woman. Step by step until it is done."
29751398,50108451,0670919985,The Power,2019,"The shape of power is always the same: it is infinite, it is complex, it is forever branching. While it is alive like a tree, it is growing; while it contains itself, it is a multitude. Its directions are unpredictable; it obeys its own laws. No one can observe the acorn and extrapolate each vein in each leaf of the oak crown. The closer you look, the more various it becomes. However complex you think it is, it is more complex than that. Like the rivers to the ocean, like the lightning strike, it is obscene and uncontained."
29751398,50108451,0670919985,The Power,2019,We’re only pretending everything is normal because we don’t know what else to do.
29751398,50108451,0670919985,The Power,2019,The only wave that changes anything is a tsunami. You have to tear down the houses and destroy that land if you want to be sure no one will forget you.
29751398,50108451,0670919985,The Power,2019,"However complicated you think it is, everything is always more complicated than that."
29751398,50108451,0670919985,The Power,2019,"It enough for her to know, sitting in there in the dark, that if she really wanted to she could get out. The knowledge is as good as freedom."
29751398,50108451,0670919985,The Power,2019,She listens at doors and around corners. She has always had this habit. A child in danger must learn to pay more attention to the adults than a child loved and cherished.
29751398,50108451,0670919985,The Power,2019,"They say: only exceptional people can cross the borders. The truth is: anyone can cross, everyone has it in them. But only exceptional people can bear to look it in the eye."
29751398,50108451,0670919985,The Power,2019,The world is the way it is now because of five thousand years of ingrained structures of power based on darker times when things were much more violent... But we don't have to act that way now. We can think and imagine ourselves differently once we understand what we 've based our ideas on.
29751398,50108451,0670919985,The Power,2019,"Have you thought about the evolutionary psychology of it? Men have evolved to be strong worker homestead-keepers, while women—with babies to protect from harm—have had to become aggressive and violent."
29751398,50108451,0670919985,The Power,2019,The way we think about our past informs what we think is possible today.
29751398,50108451,0670919985,The Power,2019,"the highest among us aren’t always the wisest,"
29751398,50108451,0670919985,The Power,2019,"Just like a man, she says. Does not know how to be silent, thinks we always want to hear what he has to say, always talking talking talking, interrupting his betters."
29751398,50108451,0670919985,The Power,2019,"Power has her ways. She acts on people, and people act on her."
29751398,50108451,0670919985,The Power,2019,"It doesn't matter that she shouldn't, that she never would. What matters is that she could if she wanted. The power to hurt is a kind of wealth."
29751398,50108451,0670919985,The Power,2019,"When does power exist? Only in the moment it is exercised. To the woman with a skein, everything looks like a fight."
29751398,50108451,0670919985,The Power,2019,"It follows that there are two ways for the nature and use of human power to change. One is that an order might issue from the palace, a command unto the people saying It is thus. But the other, the more certain, the more inevitable, is that those thousand thousand points of light should each send a new message. When the people change, the palace cannot hold."
29751398,50108451,0670919985,The Power,2019,"It was like being part of a wave of water, she says. A wave of spray from the ocean feels powerful, but it is only there for a moment, the sun dries the puddles and the water is gone. Then you feel maybe it never happened. That is how it was with us. The only wave that changes anything is a tsunami. You have to tear down the houses and destroy the land if you want to be sure no one will forget you."
29751398,50108451,0670919985,The Power,2019,There is a part in each of us which holds fast to the old truth: either you are the hunter or you are the prey. Learn which you are. Act accordingly. Your life depends upon it.
29751398,50108451,0670919985,The Power,2019,The power to hurt is a kind of wealth.
29751398,50108451,0670919985,The Power,2019,"Now they will know, shouts one woman into Tunde camera, that they are the ones who should not walk out of their houses alone at night. They are the ones who should be afraid."
29751398,50108451,0670919985,The Power,2019,Gender is a shell game. What is a man? Whatever a woman isn’t. What is a woman? Whatever a man is not. Tap on it and it hollow. Look under the shells: it not there.
29751398,50108451,0670919985,The Power,2019,It not a fucking crisis anymore. This is the new reality.
29751398,50108451,0670919985,The Power,2019,"It is only that every day one grows a little, every day something is different, so that in the heaping up of days suddenly a thing that was impossible has become possible."
33572350,54375969,0735211175,My Absolute Darling,2019,He has a way of watching her that makes her feel as if she is the most important thing in the world.
33572350,54375969,0735211175,My Absolute Darling,2019,Hold tight to the world and do not let go and do not fuck this up.
33572350,54375969,0735211175,My Absolute Darling,2019,"Dude, with your voice you are like, 'Look at all these books I've read,' but with your eyes you are like, 'Help me."
33572350,54375969,0735211175,My Absolute Darling,2019,I want to survive this. She is surprised by the depth and clarity of her desire.
33572350,54375969,0735211175,My Absolute Darling,2019,"I told him how we were washed out to sea and how it was like making furious love to a clash of orgiastic rhinos in a swimming pool filled with broken glass, and how you made a fire by staring balefully down into the reflective bottom of an aluminum can until your immense force of will was concentrated and magnified by the parabolic mirror into a white-hot spark of pure Turtle rage that could light anything on fire, even the hearts of unwary high schoolers."
33572350,54375969,0735211175,My Absolute Darling,2019,"The time will come when your soul must be absolute with your conviction, and whatever your spread, and howsoever fast you are, you will only succeed if you fight like a fucking angel, fallen to fucking earth, with a heart absolute and full of conviction, without hesitation, doubt, or fear, no part of yourself divided against the other"
33572350,54375969,0735211175,My Absolute Darling,2019,"You want to give up and you start thinking maybe it's a good idea because the pain of holding on ... because then it wouldn't hurt anymore. Because holding steady is- is- There is this bad, really bad, sense of uncertainty, an uncertainty so painful, so asshole-clenching, that it becomes- It's an awful thing to say, but it's easier to let go and be split in half than it is to try and hold on, suffering and not knowing what is going to happen. That is courage. Taking your own fucking life in your own fucking hands when that is the hardest thing you can do. No one thinks of it. Everyone thinks they'd do the right thing, but that's not true. They don't understand how scary it is. How hard it is. No one understands unless they've been there. We're there now, Jacob, and you're gonna do the right thing despite the fear and despite the hurt."
33572350,54375969,0735211175,My Absolute Darling,2019,"It will go badly for me, but the hell. I am a girl things go badly for"
33572350,54375969,0735211175,My Absolute Darling,2019,"At his best, we are more than all right. At his best he rises above all of it and he is more than any of them. But there is something in him. A flaw that poisons all the rest."
33572350,54375969,0735211175,My Absolute Darling,2019,"You need to surrender yourself to death before you ever begin, and accept your life as a state of grace, and then and only then will you be good enough."
33572350,54375969,0735211175,My Absolute Darling,2019,"She needs to get up and go home. She knows it, but she just doesn’t go"
33572350,54375969,0735211175,My Absolute Darling,2019,"Her moments of happiness occur right at the margin of unbearable. She knows it will not last and she thinks, you can never forget, Turtle, what is like, here, without him. You have to hold tight on to it, how good it is."
33572350,54375969,0735211175,My Absolute Darling,2019,"the lattice of bones, the grooved condyles like volute woodwork,"
33572350,54375969,0735211175,My Absolute Darling,2019,when just being fast and accurate won’t be enough. The time will come when your soul must be absolute with your conviction
33572350,54375969,0735211175,My Absolute Darling,2019,"Marcus Aurelius says, Jacob continues, that ‘joy for humans lies in human actions: kindness to others, contempt of the senses, the interrogation of appearances, observation of nature and of events in nature.’ This—loaning you my bag—satisfies all of those conditions. Please take it."
33572350,54375969,0735211175,My Absolute Darling,2019,"domestic competence utterly alien to her, a kind of miracle. He is saying, I am in love with George Eliot! My god! Middlemarch! That is a motherfucking book right there! Such a book—! She has a wonderful, broad, generous style; she writes the way I want my letters to Congress to sound, you know?"
33572350,54375969,0735211175,My Absolute Darling,2019,"She leaves parts of herself unnamed and unexamined, and then he will name them, and she will see herself clearly in his words and hate herself."
33572350,54375969,0735211175,My Absolute Darling,2019,"You are supposed to come to the door and believe that hell awaits just on the other side, believe that this house is full of nightmares; every personal demon you have, every worst fear"
33572350,54375969,0735211175,My Absolute Darling,2019,"she is a person like him, but she is not him, nor is she just a part of him"
33572350,54375969,0735211175,My Absolute Darling,2019,She just wants to build a garden and water it and have everything grow and everything stay alive and she does not want to feel besieged
33572350,54375969,0735211175,My Absolute Darling,2019,"She strips and cleans the SIG Sauer by the light of the oil lamp. She taps the magazine in and racks the slide and puts the gun to her temple, just to remind herself that she is never so trapped that she cannot escape. You have lost your guts. Lost your courage. You are disgraced. But, you are still here."
33572350,54375969,0735211175,My Absolute Darling,2019,"I’m taking her to Understuff. Homeslice needs a bra. You’re not, Jacob says. I am, too, dingus, Imogen says. I am not a dingus, Jacob says. Social media is gonna ban all photos of her and she won’t have any friends and then she will die alone drinking wine from a box and her hundreds of cats will close in and eat her face."
33572350,54375969,0735211175,My Absolute Darling,2019,"The truth is that things do not work out, that there are no solutions, and you can go a year, a whole year, and be no better, no more healed, maybe even worse, be so skittish that if you’re walking down the street with Anna, and if someone opens a car door and gets out and slams the door you turn around, honest-to-god ready to kill them, turn around so fast that Anna, who knows what is happening, cannot even open her mouth in time and then you’re standing there, crying, and there some guy in a leather jacket and a fedora getting out of his Volkswagen Rabbit staring at you like, is this girl all right? and you want to be like, this girl is not all right, this girl will never be all right."
206961,879622,002086910X,"Out of the Silent Planet (Space Trilogy, #1)",2019,The love of knowledge is a kind of madness.
206961,879622,002086910X,"Out of the Silent Planet (Space Trilogy, #1)",2019,"And I say also this. I do not think the forest would be so bright, nor the water so warm, nor love so sweet, if there were no danger in the lakes."
206961,879622,002086910X,"Out of the Silent Planet (Space Trilogy, #1)",2019,And how could we endure to live and let time pass if we were always crying for one day or one year to come back--if we did not know that every day in a life fills the whole life with expectation and memory and that these are that day?
206961,879622,002086910X,"Out of the Silent Planet (Space Trilogy, #1)",2019,A pleasure is full grown only when it is remembered.
