book_id,work_id,isbn,isbn13,title,num_pages,publication_year,description,author_name,author_id,book_average_rating,published,read_at,started_at,days_read,year_read
34381254,55469636,1617755885,9781617755880,An Unkindness of Ghosts,351,2017,"Odd-mannered, obsessive, withdrawn, Aster has little to offer folks in the way of rebuttal when they call her ogre and freak. She's used to the names; she only wishes there was more truth to them. If she were truly a monster, as they accuse, she'd be powerful enough to tear down the walls around her until nothing remained of her world, save for stories told around the cookfire.<br /><br />Aster lives in the low-deck slums of the HSS <i>Matilda</i>, a space vessel organized much like the antebellum South. For generations, the <i>Matilda</i> has ferried the last of humanity to a mythical Promised Land. On its way, the ship's leaders have imposed harsh moral restrictions and deep indignities on dark-skinned sharecroppers like Aster, who they consider to be less than human.<br /><br />When the autopsy of <i>Matilda</i>'s sovereign reveals a surprising link between his death and her mother's suicide some quarter-century before, Aster retraces her mother's footsteps. Embroiled in a grudge with a brutal overseer and sowing the seeds of civil war, Aster learns there may be a way off the ship if she's willing to fight for it.",Rivers Solomon,16488815,4.02,2017,2019-09-26,2019-09-22,5,2019
40816245,21394301,0998705993,9780998705996,Ink,464,2018,"Her name is Mother of Exiles. From her beacon-hand glows world-wide welcome. ""Give me your tired, your poor, your huddled masses. Send these, the homeless, tempest-tost to me."" America has lost its way. The strongest of people can be found in the unlikeliest of places. The future of the entire country will depend on them. All across the United States, people scramble to survive new, draconian policies that mark and track immigrants and their children (citizens or not) as their freedoms rapidly erode around them. For the “inked”—those whose immigration status has been permanently tattooed on their wrists—those famous words on the Statue of Liberty are starting to ring hollow. The tattoos have marked them for horrors they could not have imagined within US borders. As the nightmare unfolds before them, unforeseen alliances between the inked—like Mari, Meche, and Toño—and non-immigrants—Finn, Del, and Abbie—are formed, all in the desperate hope to confront it. Ink is the story of their ingenuity. Of their resilience. Of their magic. A story of how the power of love and community out-survives even the grimmest times.",Sabrina Vourvoulias,4446038,3.78,2018,2019-10-12,2019-10-06,7,2019
33544902,54315239,0062662570,9780062662576,An Excess Male,416,2017,"Set in a near-future China the One Child Policy has resulted in 40 million men unable to find wives. This book is one such leftover man’s quest for love and family under a State that seeks to glorify its past mistakes and impose order through authoritatian measures, reinvigorated Communist ideals, and social engineering.Wei-guo holds fast to the belief that as long as he continues to improve himself, his small business, and in turn, his country, his chance at love will come. He finally saves up the dowry required to enter matchmaking talks at the lowest rung as a third husband—the maximum allowed by law. Only a single family—one harboring an illegal spouse—shows interest, yet with May-ling and her two husbands, Wei-guo feels seen, heard, and connected to like never before. But everyone and <em>everything</em>—walls, streetlights, garbage cans—are listening, and men, excess or not, are dispensable to the State. Wei-guo must reach a new understanding of patriotism and test the limits of his love and his resolve in order to save himself and this family he has come to hold dear.",Maggie Shen King,16222012,3.67,2017,2019-08-17,2019-08-02,16,2019
57504,56024,0446674338,9780446674331,Brown Girl in the Ring,250,1998,"The rich and privileged have fled the city, barricaded it behind roadblocks, and left it to crumble. The inner city has had to rediscover old ways-farming, barter, herb lore. But now the monied need a harvest of bodies, and so they prey upon the helpless of the streets. With nowhere to turn, a young woman must open herself to ancient truths, eternal powers, and the tragic mystery surrounding her mother and grandmother.<br /><br />She must bargain with gods, and give birth to new legends.<br />",Nalo Hopkinson,27528,3.86,1998,2019-10-05,2019-10-02,4,2019
52318,1330000,0446676977,9780446676977,"Wild Seed (Patternmaster, #1)",306,2001,"Doro is an entity who changes bodies like clothes, killing his hosts by reflex or design. He fears no one until he meets Anyanwu. Anyanwu is a shapeshifter who can absorb bullets and heal with a kiss and savage anyone who threatens her. She fears no one until she meets Doro. Together they weave a pattern of destiny (from Africa to the New World) unimaginable to mortals.",Octavia E. Butler,29535,4.22,2001,2019-08-25,2019-08-18,8,2019
9678305,14566197,19335005,9781933500,Redwood and Wildfire,448,2011,"At the turn of the 20th century, minstrel shows transform into vaudeville which slides into moving pictures. Hunkering together in dark theatres, diverse audiences marvel at flickering images. This “dreaming in public” becomes common culture and part of what transforms immigrants and “native” born into Americans. Redwood, an African American woman, and Aidan, a Seminole Irish man, journey from Georgia to Chicago, from haunted swampland to a “city of the future.” They are gifted performers and hoodoo conjurors, struggling to call up the wondrous world they imagine, not just on stage and screen, but on city streets, in front parlors, in wounded hearts. The power of hoodoo is the power of the community that believes in its capacities to heal and determine the course of today and tomorrow. Living in a system stacked against them, Redwood and Aidan’s power and talent are torment and joy. Their search for a place to be who they want to be is an exhilarating, painful, magical adventure. Blues singers, filmmakers, haints, healers, and actors work their mojo for adventure, romance, and magic from Georgia to Chicago!",Andrea Hairston,656192,4.07,2011,2019-09-03,2019-08-26,9,2019
52385,316915,0140173196,9780140173192,Almanac of the Dead,768,1992,"In its extraordinary range of character and culture, Almanac of the Dead is fiction on the grand scale. The acclaimed author of Ceremony has undertaken a weaving of ideas and lives, fate and history, passion and conquest in an attempt to re-create the moral history of the Americas, told from the point of view of the conquered, not the conquerors.",Leslie Marmon Silko,29581,3.95,1992,2019-11-10,2019-10-29,13,2019
1717909,1715242,1551521687,9781551521688,When Fox is a Thousand,272,2004,"<i>When Fox is a Thousand</i> is a lyrical, magical novel, rich with poetry and folklore and elements of the fairytale. Larissa Lai interweaves three narrative voices and their attendant cultures: an elusive fox growing toward wisdom and her 1000 birthday, the ninth-century Taoist poet/nun Yu Hsuan-Chi (a real person executed in China for murder), and the oddly named Artemis, a young Asian-American woman living in contemporary Vancouver.<br /><br />With beautiful and enchanting prose, and a sure narrative hand, Lai combines Chinese mythology, the sexual politics of medieval China, and modern-day Vancouver to masterfully revise the myth of the Fox (a figure who can inhibit women’s bodies in order to cause mischief).",Larissa Lai,294057,3.76,2004,2019-09-12,2019-09-09,4,2019
15815337,21541833,1594486042,9781594486043,The Miniature Wife and Other Stories,304,2013,"<b>In the tradition of George Saunders and Aimee Bender, an exuberantly imagined debut that chronicles an ordinary world marked by unusual phenomena.<br /></b><br /> The eighteen stories of Manuel Gonzales’s exhilarating first book render the fantastic commonplace and the ordinary extraordinary, in prose that thrums with energy and shimmers with beauty. In “The Artist’s Voice” we meet one of the world’s foremost composers, a man who speaks through his ears. A hijacked plane circles a city for twenty years in “Pilot, Copilot, Writer.” Sound can kill in “The Sounds of Early Morning.” And, in the title story, a man is at war with the wife he accidentally shrank. For these characters, the phenomenal isn’t necessarily special—but it’s often dangerous.<br /><br /> In slightly fantastical settings, Gonzales illustrates very real guilt over small and large marital missteps, the intense desire for the reinvention of self, and the powerful urges we feel to defend and provide for the people we love. With wit and insight, these stories subvert our expectations and challenge us to look at our surroundings with fresh eyes. Brilliantly conceived, strikingly original, and told with the narrative instinct of a born storyteller, <i>The Miniature Wife </i>is an unforgettable debut.",Manuel  Gonzales,6951449,3.59,2013,2019-07-24,2019-07-18,7,2019
13641208,19256026,0812993802,9780812993806,Tenth of December,251,2013,"One of the most important and blazingly original writers of his generation, George Saunders is an undisputed master of the short story, and <i>Tenth of December</i> is his most honest, accessible, and moving collection yet.<br /><br />In the taut opening, ""Victory Lap,"" a boy witnesses the attempted abduction of the girl next door and is faced with a harrowing choice: Does he ignore what he sees, or override years of smothering advice from his parents and act? In ""Home,"" a combat-damaged soldier moves back in with his mother and struggles to reconcile the world he left with the one to which he has returned. And in the title story, a stunning meditation on imagination, memory, and loss, a middle-aged cancer patient walks into the woods to commit suicide, only to encounter a troubled young boy who, over the course of a fateful morning, gives the dying man a final chance to recall who he really is. A hapless, deluded owner of an antique store; two mothers struggling to do the right thing; a teenage girl whose idealism is challenged by a brutal brush with reality; a man tormented by a series of pharmaceutical experiments that force him to lust, to love, to kill—the unforgettable characters that populate the pages of <i>Tenth of December</i> are vividly and lovingly infused with Saunders' signature blend of exuberant prose, deep humanity, and stylistic innovation.<br /><br />Writing brilliantly and profoundly about class, sex, love, loss, work, despair, and war, Saunders cuts to the core of the contemporary experience. These stories take on the big questions and explore the fault lines of our own morality, delving into the questions of what makes us good and what makes us human.<br /><br />Unsettling, insightful, and hilarious, the stories in <i>Tenth of December</i>—through their manic energy, their focus on what is redeemable in human beings, and their generosity of spirit—not only entertain and delight; they fulfill Chekhov's dictum that art should ""prepare us for tenderness.""",George Saunders,8885,3.96,2013,2019-07-11,2019-07-08,4,2019
31554413,52235042,0316300330,9780316300339,The Boy on the Bridge (The Girl With All the Gifts #2),369,2017,"Once upon a time, in a land blighted by terror, there was a very clever boy.<br /><br />The people thought the boy could save them, so they opened their gates and sent him out into the world.<br /><br />To where the monsters lived.",M.R. Carey,7177350,3.96,2017,2019-07-17,2019-07-11,7,2019
29751398,50108451,0670919985,9780670919987,The Power,341,2017,"In <i>The Power</i> the world is a recognisable place: there's a rich Nigerian kid who lounges around the family pool; a foster girl whose religious parents hide their true nature; a local American politician; a tough London girl from a tricky family. But something vital has changed, causing their lives to converge with devastating effect. Teenage girls now have immense physical power - they can cause agonising pain and even death. And, with this small twist of nature, the world changes utterly.<br /><br />This extraordinary novel by Naomi Alderman, a <i>Sunday Times</i> Young Writer of the Year and Granta Best of British writer, is not only a gripping story of how the world would change if power was in the hands of women but also exposes, with breath-taking daring, our contemporary world.",Naomi Alderman,118226,3.81,2017,2019-06-27,2019-06-22,6,2019
33572350,54375969,0735211175,9780735211179,My Absolute Darling,417,2017,"At 14, Turtle Alveston knows the use of every gun on her wall. She knows how to snare a rabbit, sharpen a blade and splint a bone. She knows that her daddy loves her more than anything else in this world and he’ll do whatever it takes to keep her with him.<br /><br />But she doesn’t know why she feels so different from the other girls at school; why the line between love and pain can be so hard to see. Or why making a friend may be the bravest and most terrifying thing she has ever done.<br /><br />Sometimes the people you’re supposed to trust are the ones who do most harm. And what you’ve been taught to fear is the very thing that will save you…",Gabriel Tallent,16231256,3.62,2017,2019-06-12,2019-06-07,6,2019
206961,879622,002086910X,9780020869108,"Out of the Silent Planet (Space Trilogy, #1)",160,1965,"<i>""Adventure beyond our Earth - beautifully coloured and shaped.""</i> - The Times <br /><br /><i>""This book has real splendour, compelling moments and a flowing narrative.""</i> - The New York Times <br /><br />Written during the dark hours immediately before and during the Second World War, C.S. Lewis's Space Trilogy, of which <i>Out of the Silent Planet</i> is the first volume, stands alongside such works as Albert Camus's <i>The Plague</i> and George Orwell's <i>1984 </i>as a timely parable that has become timeless, beloved by succeeding generations as much for the sheer wonder of its storytelling as for the significance of the moral concerns. For the trilogy's central figure, C.S. Lewis created perhaps the most memorable character of his career, the brilliant, clear-eyed, and fiercely brave philologist Dr. Elwin Ransom. Appropriately, Lewis modeled Dr. Ransom after his dear friend J.R.R. Tolkien, for in the scope of its imaginative achievement and the totality of its vision of not one but two imaginary worlds, the Space Trilogy is rivaled in this century only by Tolkien's trilogy <i>The Lord of the Rings</i>. Readers who fall in love with Lewis's fantasy series <i>The Chronicles of Namia</i> as children unfailingly cherish his <i>Space Trilogy</i> as adults; it, too, brings to life strange and magical realms in which epic battles are fought between the forces of light and those of darkness. But in the many layers of its allegory, and the sophistication and piercing brilliance of its insights into the human condition, it occupies a place among the English language's most extraordinary works for any age, and for all time.",C.S. Lewis,1069006,3.92,1965,2019-06-07,2019-06-04,4,2019
52397,59258,0446675504,9780446675505,"Parable of the Sower (Earthseed, #1)",345,2000,"In 2025, with the world descending into madness and anarchy, one woman begins a fateful journey toward a better future.<br /><br />Lauren Olamina and her family live in one of the only safe neighborhoods remaining on the outskirts of Los Angeles. Behind the walls of their defended enclave, Lauren’s father, a preacher, and a handful of other citizens try to salvage what remains of a culture that has been destroyed by drugs, disease, war, and chronic water shortages. While her father tries to lead people on the righteous path, Lauren struggles with hyperempathy, a condition that makes her extraordinarily sensitive to the pain of others.<br /><br />When fire destroys their compound, Lauren’s family is killed and she is forced out into a world that is fraught with danger. With a handful of other refugees, Lauren must make her way north to safety, along the way conceiving a revolutionary idea that may mean salvation for all mankind.",Octavia E. Butler,29535,4.16,2000,2019-06-03,2019-05-30,5,2019
40163361,62303737,0525508805,9780525508809,A People's Future of the United States: Speculative Fiction from 25 Extraordinary Writers,432,2019,"<b>
  <b>What if America's founding ideals finally became reality? A future of peace, justice, and love comes to life in original speculative stories that challenge oppression and embrace inclusiveness—from N. K. Jemisin, Charles Yu, Jamie Ford, and more.</b>
</b><br /><br />For many Americans, imagining a bright future has always been an act of resistance. <i>A People's Future of the United States</i> presents twenty never-before-published stories by a diverse group of writers, featuring voices both new and well-established. These stories imagine their characters fighting everything from government surveillance, to corporate cities, to climate change disasters, to nuclear wars. But fear not: <i>A People's Future</i> also invites readers into visionary futures in which the country is shaped by justice, equity, and joy.<br /><br />Edited by Victor LaValle and John Joseph Adams, this collection features a glittering landscape of moving, visionary stories written from the perspective of people of color, indigenous writers, women, queer &amp; trans people, Muslims and other people whose lives are often at risk.<br /><br /><b>Contributors include: </b>Violet Allen, Charlie Jane Anders, Ashok K. Banker, Tobias S. Buckell, Tananarive Due, Omar El Akkad, Jamie Ford, Maria Dahvana Headley, Hugh Howey, Lizz Huerta, Justina Ireland, N. K. Jemisin, Alice Sola Kim, Seanan McGuire, Sam J. Miller, Daniel José Older, Malka Older, Gabby Rivera, A. Merc Rustad, Kai Cheng Thom, Catherynne M. Valente, Daniel H. Wilson, G. Willow Wilson, and Charles Yu.",Victor LaValle,1762294,3.82,2019,2019-05-29,2019-05-22,8,2019
41556003,58029884,1250214998,9781250214997,Severance,291,2019,"<b>Maybe it's the end of the world, but not for Candace Chen, a millennial, first-generation American and office drone meandering her way into adulthood in Ling Ma's offbeat, wryly funny, apocalyptic satire, <i>Severance</i>.</b><br /><br />Candace Chen, a millennial drone self-sequestered in a Manhattan office tower, is devoted to routine. With the recent passing of her Chinese immigrant parents, she's had her fill of uncertainty. She's content just to carry on: She goes to work, troubleshoots the teen-targeted Gemstone Bible, watches movies in a Greenpoint basement with her boyfriend.<br /><br />So Candace barely notices when a plague of biblical proportions sweeps New York. Then Shen Fever spreads. Families flee. Companies cease operations. The subways screech to a halt. Her bosses enlist her as part of a dwindling skeleton crew with a big end-date payoff. Soon entirely alone, still unfevered, she photographs the eerie, abandoned city as the anonymous blogger NY Ghost.<br /><br />Candace won't be able to make it on her own forever, though. Enter a group of survivors, led by the power-hungry IT tech Bob. They're traveling to a place called the Facility, where, Bob promises, they will have everything they need to start society anew. But Candace is carrying a secret she knows Bob will exploit. Should she escape from her rescuers?<br /><br />A send-up and takedown of the rituals, routines, and missed opportunities of contemporary life, Ling Ma's <i>Severance </i>is a moving family story, a quirky coming-of-adulthood tale, and a hilarious, deadpan satire. Most important, it's a heartfelt tribute to the connections that drive us to do more than survive.",Ling  Ma,17343848,3.83,2019,2019-05-13,2019-05-11,3,2019
39863330,61659555,1250297664,9781250297662,Broken Stars: Contemporary Chinese Science Fiction in Translation,480,2019,"<i>Broken Stars</i>, edited by multi award-winning writer Ken Liu - translator of the bestselling and Hugo Award-winning novel <i>The Three Body Problem</i> by acclaimed Chinese author Cixin Liu - is his second thought-provoking anthology of Chinese short speculative fiction. Following <i>Invisible Planets</i>, Liu has now assembled the most comprehensive collection yet available in the English language, sure to thrill and gratify readers developing a taste and excitement for Chinese SF.<br /><br />Some of the included authors are already familiar to readers in the West (Liu Cixin and Hao Jingfang, both Hugo winners); some are publishing in English for the first time. Because of the growing interest in newer SFF from China, virtually every story here was first published in Chinese in the 2010s.<br /><br />The stories span the range from short-shorts to novellas, and evoke every hue on the emotional spectrum. Besides stories firmly entrenched in subgenres familiar to Western SFF readers such as hard SF, cyberpunk, science fantasy, and space opera, the anthology also includes stories that showcase deeper ties to Chinese culture: alternate Chinese history, <i>chuanyue</i> time travel, satire with historical and contemporary allusions that are likely unknown to the average Western reader. While the anthology makes no claim or attempt to be ""representative"" or ""comprehensive,"" it demonstrates the vibrancy and diversity of science fiction being written in China at this moment.<br /><br />In addition, three essays at the end of the book explore the history of Chinese science fiction publishing, the state of contemporary Chinese fandom, and how the growing interest in science fiction in China has impacted writers who had long labored in obscurity.<br /><br />Stories include: <br />""Goodnight, Melancholy"" by Xia Jia <br />""The Snow of Jinyang"" by Zhang Ran <br />""Broken Stars"" by Tang Fei <br />""Submarines"" by Han Song <br />""Salinger and the Koreans"" by Han Song <br />""Under a Dangling Sky"" by Cheng Jingbo <br />""What Has Passed Shall in Kinder Light Appear"" by Baoshu<br />""The New Year Train"" by Hao Jingfang <br />""The Robot Who Liked to Tell Tall Tales"" by Fei Dao <br />""Moonlight"" by Liu Cixin <br />""The Restaurant at the End of the Universe: Laba Porridge"" by Anna Wu <br />""The First Emperor's Games"" by Ma Boyong <br />""Reflection"" by Gu Shi<br />""The Brain Box"" by Regina Kanyu Wang<br />""Coming of the Light"" by Chen Qiufan <br />""A History of Future Illnesses"" by Chen Qiufan<br /><br />Essays: <br />""A Brief Introduction to Chinese Science Fiction and Fandom,"" by Regina Kanyu Wang, <br />""A New Continent for China Scholars: Chinese Science Fiction Studies"" by Mingwei Song<br />""Science Fiction: Embarrassing No More"" by Fei Dao<br /><br />For more Chinese SF in translation, check out <i>Invisible Planets</i>.",Ken Liu,2917920,3.85,2019,2019-05-10,2019-04-29,12,2019
1118485,2371216,0156235501,9780156235501,The Cyberiad,312,1985,"Trurl and Klaupacius are constructor robots who try to out-invent each other. They travel to the far corners of the cosmos to take on freelance problem-solving jobs, with dire consequences for their employers. “The most completely successful of his books... here Lem comes closest to inventing a real universe” (Boston Globe). Illustrations by Daniel Mr—z. Translated by Michael Kandel.<br />",Stanisław Lem,10991,4.18,1985,2019-05-22,2019-04-25,28,2019
40855636,63632161,0316491349,9780316491341,How Long 'til Black Future Month?,400,2018,"In these stories, Jemisin sharply examines modern society, infusing magic into the mundane, and drawing deft parallels in the fantasy realms of her imagination. Dragons and hateful spirits haunt the flooded city of New Orleans in the aftermath of Hurricane Katrina. In a parallel universe, a utopian society watches our world, trying to learn from our mistakes. A black mother in the Jim Crow south must figure out how to save her daughter from a fey offering impossible promises. And in the Hugo award-nominated short story “The City Born Great,” a young street kid fights to give birth to an old metropolis’s soul.",N.K. Jemisin,2917917,4.29,2018,2019-04-24,2019-04-15,10,2019
