book_id,work_id,isbn,isbn13,title,num_pages,publication_year,description,author_name,author_id,book_average_rating,published,read_at,started_at,days_read,year_read
45869112,70686438,1942658702,9781942658702,The Bear,224,2020,"<b>From National Book Award in Fiction finalist Andrew Krivak comes a gorgeous fable of Earth’s last two human inhabitants and a girl's journey home.</b><br /><br />In an Eden-like future, a girl and her father live close to the land in the shadow of a lone mountain. They own a few remnants of civilization: some books, a pane of glass, a set of flint and steel, a comb. The father teaches his daughter how to fish and hunt and the secrets of the seasons and the stars. He is preparing her for an adulthood in harmony with nature, for they are the last of humankind. But when the girl finds herself alone in an unknown landscape, it is a bear that will lead her back home through a vast wilderness that offers the greatest lessons of all, if she can learn to listen. A cautionary tale of human fragility, of love and loss, <i>The Bear</i> is a stunning tribute to the beauty of nature’s dominion.",Andrew Krivak,509654,3.86,2020,2020-09-21,2020-09-20,2,2020
121531,117015,0938077546,9780938077541,Mindfulness and Meaningful Work: Explorations in Right Livelihood,289,2005,"""Mindfulness and Meaningful Work is a classic, providing a wealth of resources for investigating the challenge of integrating work with spiritual practice. It contains thirty-seven contributions by some of the leading thinkers and activists of our time, helping us to find work that is meaningful, life-affirming, and non-exploitive.",Claude Whitmyer,70151,3.96,2005,2020-09-15,2020-09-10,6,2020
159961,154391,1590303806,9781590303801,The Dhammapada,152,2006,"The <i>Dhammapada</i> is the most widely read Buddhist scripture in existence, enjoyed by both Buddhists and non-Buddhists. This classic text of teaching verses from the earliest period of Buddhism in India conveys the philosophical and practical foundations of the Buddhist tradition. The text presents two distinct goals for leading a spiritual life: the first is attaining happiness in this life (or in future lives); the second goal is the achievement of spiritual liberation, freedom, absolute peace. Many of the key themes of the verses are presented in dichotomies or pairs, for example, grief and suffering versus joy; developing the mind instead of being negligent about one's mental attitude and conduct; virtuous action versus misconduct; and being truthful versus being deceitful. The purpose of these contrasts is, very simply, to describe the difference between what leads to desirable outcomes and what does not. <br /><br />For centuries, this text has been studied in its original Pali, the canonical language of Buddhism in Southeast Asia. This fresh new translation from Insight Mediation teacher and Pail translator Gil Fronsdal is both highly readable and scholarly authoritative. With extensive explanatory notes, this edition combines a rigorous attention to detail in bringing forth the original text with the translator's personal knowledge of the Buddhist path. It is the first truly accurate and highly readable translation of this text to be published in English.",Anonymous,5158478,4.27,2006,2020-08-10,2020-08-09,2,2020
53359489,70862605,0374388350,9780374388355,A Peculiar Peril,656,2020,"<b><i>A Peculiar Peril</i> is a head-spinning epic about three friends on a quest to protect the world from a threat as unknowable as it is terrifying, from the Nebula Award-winning and <i>New York Times</i> bestselling author of<i> Annihilation</i>, Jeff VanderMeer.</b><br /><br /><br /><br />Jonathan Lambshead stands to inherit his deceased grandfather's overstuffed mansion--a veritable cabinet of curiosities--once he and two schoolmates catalog its contents. But the three soon discover that the house is filled with far more than just oddities: It holds clues linking to an alt-Earth called Aurora, where the notorious English occultist Aleister Crowley has stormed back to life on a magic-fueled rampage across a surreal, through-the-looking-glass version of Europe replete with talking animals (and vegetables).<br /><br />Swept into encounters with allies more unpredictable than enemies, Jonathan pieces together his destiny as a member of a secret society devoted to keeping our world separate from Aurora. But as the ground shifts and allegiances change with every step, he and his friends sink ever deeper into a deadly pursuit of the profound evil that is also chasing after them.",Jeff VanderMeer,33919,3.40,2020,2020-09-08,2020-08-28,12,2020
17573681,19249362,0393346617,9780393346619,Spillover: Animal Infections and the Next Human Pandemic,592,2013,"Ebola, SARS, Hendra, AIDS, and countless other deadly viruses all have one thing in common: the bugs that transmit these diseases all originate in wild animals and pass to humans by a process called spillover. In this gripping account, David Quammen takes the reader along on this astonishing quest to learn how, where from, and why these diseases emerge and asks the terrifying question: What might the next big one be?",David Quammen,32307,4.37,2013,2020-08-06,2020-07-31,7,2020
3057677,3088578,061516286X,9780615162867,The Issue at Hand:  Essays on Buddhist Mindfulness Practice,160,2008,"Essays on Buddhist Mindfulness Practice. An inspiring and very accessible compilation of essays and edited talks on the Buddhist practice of mindfulness. As Gil Fronsdal states, ""the search for the issue at hand is the search for what is closest at hand, for what is directly seen, heard, smelt, tasted, felt, and cognized in the present."" Gil brings the practice of mindfulness not only to formal meditation but to all the varying aspects of every day life.<br /><a target=""_blank"" rel=""noopener nofollow"" href=""http://www.insightmeditationcenter.org/documents/iah/IssueAtHand4thEd.pdf"">http://www.insightmeditationcenter.or...</a>.",Gil Fronsdal,92752,4.40,2008,2020-07-27,2020-07-25,3,2020
8377052,7356968,0385528205,9780385528207,"The Other Wes Moore: One Name, Two Fates",272,2011,"<b>The chilling truth is that his story could have been mine. The tragedy is that my story could have been his.</b><br /><br />Two kids named Wes Moore were born blocks apart within a year of each other. Both grew up fatherless in similar Baltimore neighborhoods and had difficult childhoods; both hung out on street corners with their crews; both ran into trouble with the police. How, then, did one grow up to be a Rhodes Scholar, decorated veteran, White House Fellow, and business leader, while the other ended up a convicted murderer serving a life sentence? Wes Moore, the author of this fascinating book, sets out to answer this profound question. In alternating narratives that take readers from heart-wrenching losses to moments of surprising redemption, <i>The Other Wes Moore</i> tells the story of a generation of boys trying to find their way in a hostile world.",Wes  Moore,5156034,3.84,2011,2020-07-25,2020-07-23,3,2020
960312,304822,0231086067,9780231086066,Chuang Tzu: Basic Writings,148,1964,"Chuang Tzu (<a href=""https://www.goodreads.com/author/show/149093.Zhuangzi"" title=""Zhuangzi"" rel=""nofollow noopener"">Zhuangzi</a>, 369?–286? B.C.) was a leading thinker representing the Taoist strain in Chinese thought. Using parable and anecdote, allegory and paradox, he set forth the early ides of what was to become the Taoist school. Central in these is the belief that only by understanding Tao (the Way of Nature) and dwelling in its unity can man achieve true happiness and be truly free, in both life and death. Witty and imaginative, enriched by brilliant imagery, making sportive use of both mythlogical and historical personages (including even Confucius), the book which bears Chuang Tzu's name has for centuries been savored by Chinese readers.<br /><br />This translation, by Burton Watson, of Chuang Tzu's basic writings includes the seven ""inner chapters,"" which form the heart of the book, three of the ""outer chapters,"" and one of the ""miscellaneous chapters."" An introduction places the philosopher in relation to Chinese history and thought.",Chaung Tzu,4466293,4.27,1964,2020-07-22,2020-07-20,3,2020
50608676,48215793,0735220182,9780735220188,"Black Leopard, Red Wolf",640,2020,"In the first novel in Marlon James's Dark Star trilogy, myth, fantasy, and history come together to explore what happens when a mercenary is hired to find a missing child. <br /><br />Tracker is known far and wide for his skills as a hunter: ""He has a nose,"" people say. Engaged to track down a mysterious boy who disappeared three years earlier, Tracker breaks his own rule of always working alone when he finds himself part of a group that comes together to search for the boy. The band is a hodgepodge, full of unusual characters with secrets of their own, including a shape-shifting man-animal known as Leopard.<br /><br />Drawing from African history and mythology and his own rich imagination, Marlon James has written an adventure that's also an ambitious, involving read. Defying categorization and full of unforgettable characters, Black Leopard, Red Wolf explores the fundamentals of truths, the limits of power, the excesses of ambition, and our need to understand them all.",Marlon James,56064,3.44,2020,2020-08-20,2020-08-10,11,2020
415907,736076,0452264464,9780452264465,Beloved,290,1988,"Winner of the Pulitzer Prize, Toni Morrison’s Beloved is a spellbinding and dazzlingly innovative portrait of a woman haunted by the past.<br /><br />Sethe was born a slave and escaped to Ohio, but eighteen years later she is still not free. She has borne the unthinkable and not gone mad, yet she is still held captive by memories of Sweet Home, the beautiful farm where so many hideous things happened. Meanwhile Sethe’s house has long been troubled by the angry, destructive ghost of her baby, who died nameless and whose tombstone is engraved with a single word: Beloved.<br /><br />Sethe works at beating back the past, but it makes itself heard and felt incessantly in her memory and in the lives of those around her. When a mysterious teenage girl arrives, calling herself Beloved, Sethe’s terrible secret explodes into the present.<br /><br />Combining the visionary power of legend with the unassailable truth of history, Morrison’s unforgettable novel is one of the great and enduring works of American literature.",Toni Morrison,3534,3.86,1988,2020-07-20,2020-07-07,14,2020
10365343,15268500,0385528078,9780385528078,Zone One,259,2011,"In this wry take on the post-apocalyptic horror novel, a pandemic has devastated the planet. The plague has sorted humanity into two types: the uninfected and the infected, the living and the living dead. <br /><br />Now the plague is receding, and Americans are busy rebuild­ing civilization under orders from the provisional govern­ment based in Buffalo. Their top mission: the resettlement of Manhattan. Armed forces have successfully reclaimed the island south of Canal Street—aka Zone One—but pockets of plague-ridden squatters remain. While the army has eliminated the most dangerous of the infected, teams of civilian volunteers are tasked with clearing out a more innocuous variety—the “malfunctioning” stragglers, who exist in a catatonic state, transfixed by their former lives. <br /><br />Mark Spitz is a member of one of the civilian teams work­ing in lower Manhattan. Alternating between flashbacks of Spitz’s desperate fight for survival during the worst of the outbreak and his present narrative, the novel unfolds over three surreal days, as it depicts the mundane mission of straggler removal, the rigors of Post-Apocalyptic Stress Disorder, and the impossible job of coming to grips with the fallen world. <br /><br />And then things start to go wrong. <br /><br />Both spine chilling and playfully cerebral, <i>Zone One</i> bril­liantly subverts the genre’s conventions and deconstructs the zombie myth for the twenty-first century.",Colson Whitehead,10029,3.26,2011,2020-07-05,2020-07-02,4,2020
3181564,3214322,0312427808,9780312427801,The Housekeeper and the Professor,180,2009,"He is a brilliant math Professor with a peculiar problem--ever since a traumatic head injury, he has lived with only eighty minutes of short-term memory. <br /><br />She is an astute young Housekeeper, with a ten-year-old son, who is hired to care for him. <br /><br />And every morning, as the Professor and the Housekeeper are introduced to each other anew, a strange and beautiful relationship blossoms between them. Though he cannot hold memories for long (his brain is like a tape that begins to erase itself every eighty minutes), the Professor’s mind is still alive with elegant equations from the past. And the numbers, in all of their articulate order, reveal a sheltering and poetic world to both the Housekeeper and her young son. The Professor is capable of discovering connections between the simplest of quantities--like the Housekeeper’s shoe size--and the universe at large, drawing their lives ever closer and more profoundly together, even as his memory slips away. <br /><br />The Housekeeper and the Professor is an enchanting story about what it means to live in the present, and about the curious equations that can create a family.",Yōko Ogawa,42775,3.96,2009,2020-07-01,2020-07-01,1,2020
23129839,42677666,1849352097,9781849352093,Octavia's Brood: Science Fiction Stories from Social Justice Movements,296,2015,"Whenever we envision a world without war, without prisons, without capitalism, we are producing visionary fiction. Organizers and activists envision, and try to create, such worlds all the time. This book brings twenty of them together in the first anthology of short stories to explore the connections between radical speculative fiction and movements for social change. The visionary tales of <i>Octavia's Brood</i> span genres—sci-fi, fantasy, horror, magical realism—but all are united by an attempt to experiment with new ways of understanding ourselves, the world around us, and all the selves and worlds that could be. The collection is rounded off with essays by Tananarive Due and Mumia Abu-Jamal, and a foreword by Sheree Renée Thomas.",Adrienne Maree Brown,1536532,3.95,2015,2020-06-30,2020-06-27,4,2020
210783,1135707,0679746315,9780679746317,Up in the Old Hotel,716,1993,"Saloon-keepers and street preachers, gypsies and steel-walking Mohawks, a bearded lady and a 93-year-old “seafoodetarian” who believes his specialized diet will keep him alive for another two decades. These are among the people that Joseph Mitchell immortalized in his reportage for <i>The New Yorker</i> and in four books—<i>McSorley's Wonderful Saloon</i>, <i>Old Mr. Flood</i>, <i>The Bottom of the Harbor</i>, and <i>Joe Gould's Secret</i>—that are still renowned for their precise, respectful observation, their graveyard humor, and their offhand perfection of style.These masterpieces (along with several previously uncollected stories) are available in one volume, which presents an indelible collective portrait of an unsuspected New York and its odder citizens—as depicted by one of the great writers of this or any other time.",Joseph Mitchell,123376,4.33,1993,2020-06-26,2020-06-19,8,2020
40032435,62013997,1618731556,9781618731555,Sooner or Later Everything Falls Into the Sea,288,2019,"The baker's dozen stories gathered here (including a new, previously unpublished story) turn readers into travelers to the past, the future, and explorers of the weirder points of the present. The journey is the thing as Pinsker weaves music, memory, technology, history, mystery, love, loss, and even multiple selves on generation ships and cruise ships, on highways and high seas, in murder houses and treehouses. They feature runaways, fiddle-playing astronauts, and retired time travelers; they are weird, wired, hopeful, haunting, and deeply human. They are often described as beautiful but Pinsker also knows that the heart wants what the heart wants and that is not always right, or easy.",Sarah Pinsker,6683690,4.32,2019,2020-06-17,2020-06-13,5,2020
43526443,52603794,1618731653,9781618731654,Tender: Stories,,,"The first collection of short fiction from a rising star whose stories have been anthologized in the first two volumes of the <i>Best American Science Fiction and Fantasy</i> series and nominated for many awards. Some of Samatar’s weird and tender fabulations spring from her life and her literary studies; some spring from the world, some from the void.",Sofia Samatar,5258016,4.18,,2020-06-12,2020-06-05,8,2020
43223112,64410073,1984802585,9781984802583,A Song for a New Day,372,2019,"In the Before, when the government didn't prohibit large public gatherings, Luce Cannon was on top of the world. One her songs had just taken off and she was on her way to becoming a star. Now, in the After, terror attacks and deadly viruses have led the government to ban concerts, and Luce's connection to the world - her music, her purpose - is closed off forever. She does what she has to do: She performs in illegal concerts to a small but passionate community, always evading the law.<br /><br />Rosemary Laws barely remembers the Before times. She spends her days in Hoodspace, helping customers order all of their goods online for drone delivery - no physical contact with humans needed. By lucky chance, she finds a new job and a new calling: discover amazing musicians an bring their concerts to everyone via virtual reality. The only catch is that she'll have to do something she's never done before and go out in public. Find the illegal concerts and bring musicians into the limelight they deserve. But when she sees how the world could actually be, that won't be enough.",Sarah Pinsker,6683690,4.08,2019,2020-06-05,2020-06-02,4,2020
38746152,60335246,1616207922,9781616207922,The Book of Delights,274,2019,"Ross Gay’s <i>The Book of Delights</i> is a genre-defying book of essays—some as short as a paragraph; some as long as five pages—that record the small joys that occurred in one year, from birthday to birthday, and that we often overlook in our busy lives. His is a meditation on delight that takes a clear-eyed view of the complexities, even the terrors, in his life, including living in America as a black man; the ecological and psychic violence of our consumer culture; the loss of those he loves. Among Gay’s funny, poetic, philosophical delights: the way Botan Rice Candy wrappers melt in your mouth, the volunteer crossing guard with a pronounced tremor whom he imagines as a kind of boat-woman escorting pedestrians across the River Styx, a friend’s unabashed use of air quotes, pickup basketball games, the silent nod of acknowledgment between black people. And more than any other subject, Gay celebrates the beauty of the natural world—his garden, the flowers in the sidewalk, the birds, the bees, the mushrooms, the trees.<br /><br />This is not a book of how-to or inspiration, though it could be read that way. Fans of Roxane Gay, Maggie Nelson, and Kiese Laymon will revel in Gay’s voice, and his insights.<i> The Book of Delights </i>is about our connection to the world, to each other, and the rewards that come from a life closely observed. Gay’s pieces serve as a powerful and necessary reminder that we can, and should, stake out a space in our lives for delight. ",Ross Gay,457563,4.32,2019,2020-05-24,2020-05-23,2,2020
34217599,55268475,0062694057,9780062694058,Future Home of the Living God,263,2017,"Louise Erdrich, the <em>New York Times</em> bestselling, National Book Award-winning author of <em>LaRose</em> and <em>The Round House</em>, paints a startling portrait of a young woman fighting for her life and her unborn child against oppressive forces that manifest in the wake of a cataclysmic event.<br /><br />The world as we know it is ending. Evolution has reversed itself, affecting every living creature on earth. Science cannot stop the world from running backwards, as woman after woman gives birth to infants that appear to be primitive species of humans. Twenty-six-year-old Cedar Hawk Songmaker, adopted daughter of a pair of big-hearted, open-minded Minneapolis liberals, is as disturbed and uncertain as the rest of America around her. But for Cedar, this change is profound and deeply personal. She is four months pregnant.<br /><br />Though she wants to tell the adoptive parents who raised her from infancy, Cedar first feels compelled to find her birth mother, Mary Potts, an Ojibwe living on the reservation, to understand both her and her baby’s origins. As Cedar goes back to her own biological beginnings, society around her begins to disintegrate, fueled by a swelling panic about the end of humanity.<br /><br />There are rumors of martial law, of Congress confining pregnant women. Of a registry, and rewards for those who turn these wanted women in. Flickering through the chaos are signs of increasing repression: a shaken Cedar witnesses a family wrenched apart when police violently drag a mother from her husband and child in a parking lot. The streets of her neighborhood have been renamed with Bible verses. A stranger answers the phone when she calls her adoptive parents, who have vanished without a trace. It will take all Cedar has to avoid the prying eyes of potential informants and keep her baby safe.<br /><br />A chilling dystopian novel both provocative and prescient, <em>Future Home of the Living God</em> is a startlingly original work from one of our most acclaimed writers: a moving meditation on female agency, self-determination, biology, and natural rights that speaks to the troubling changes of our time.",Louise Erdrich,9388,3.55,2017,2020-05-21,2020-05-19,3,2020
384009,373765,0805055894,9780805055894,Tabloid Dreams,,,"Robert Olen Butler's last short story collection, <i>A Good Scent from a Strange Mountain</i>, was a keen, piercing book told largely in the voice of Vietnamese immigrants to America. To say that his new collection is a departure is an understatement: Butler has taken actual headlines from the more outrageous of the supermarket tabloids and fashioned short fiction around them. Headlines such as ""Titanic Victim Speaks Through Waterbed,"" ""Woman Loses Cookie Bake-Off, Sets Self on Fire,"" and ""Every Man She Kisses Dies"" are the starting points for this quirky volume from one of the most original American writers at work today.",Robert Olen Butler,90820,3.83,,2020-05-18,2020-05-15,4,2020
60932,249012,0446610380,9780446610384,"Parable of the Talents (Earthseed, #2)",448,2001,"This Nebula Award-winning sequel to <i>Parable of the Sower</i> continues the story of Lauren Olamina in socially and economically depressed California in the 2030s. Convinced that her community should colonize the stars, Lauren and her followers make preparations. But the collapse of society and rise of fanatics result in Lauren's followers being enslaved, and her daughter stolen from her. Now, Lauren must fight back to save the new world order.",Octavia E. Butler,29535,4.27,2001,2020-06-01,2020-05-25,8,2020
35187203,57662223,039363552X,9780393635522,The Overstory,502,2018,"An Air Force loadmaster in the Vietnam War is shot out of the sky, then saved by falling into a banyan. An artist inherits a hundred years of photographic portraits, all of the same doomed American chestnut. A hard-partying undergraduate in the late 1980s electrocutes herself, dies, and is sent back into life by creatures of air and light. A hearing- and speech-impaired scientist discovers that trees are communicating with one another. These four, and five other strangers—each summoned in different ways by trees—are brought together in a last and violent stand to save the continent’s few remaining acres of virgin forest.<br /><br />In his twelfth novel, National Book Award winner Richard Powers delivers a sweeping, impassioned novel of activism and resistance that is also a stunning evocation of—and paean to—the natural world. From the roots to the crown and back to the seeds, <em>The Overstory</em> unfolds in concentric rings of interlocking fables that range from antebellum New York to the late twentieth-century Timber Wars of the Pacific Northwest and beyond, exploring the essential conflict on this planet: the one taking place between humans and nonhumans. There is a world alongside ours—vast, slow, interconnected, resourceful, magnificently inventive, and almost invisible to us. This is the story of a handful of people who learn how to see that world and who are drawn up into its unfolding catastrophe.<br /><br /><em>The Overstory</em> is a book for all readers who despair of humanity’s self-imposed separation from the rest of creation and who hope for the transformative, regenerating possibility of a homecoming. If the trees of this earth could speak, what would they tell us? <em>""Listen. There’s something you need to hear.""</em>",Richard Powers,11783,4.14,2018,2020-05-06,2020-04-26,11,2020
11334,3215642,140003342X,9781400033423,Song of Solomon,337,2004,"Milkman Dead was born shortly after a neighborhood eccentric hurled himself off a rooftop in a vain attempt at flight. For the rest of his life he, too, will be trying to fly. With this brilliantly imagined novel, Toni Morrison transfigures the coming-of-age story as audaciously as Saul Bellow or Gabriel García Márquez. As she follows Milkman from his rustbelt city to the place of his family’s origins, Morrison introduces an entire cast of strivers and seeresses, liars and assassins, the inhabitants of a fully realized black world.",Toni Morrison,3534,4.08,2004,2020-04-25,2020-04-20,6,2020
